{
  "additional_info": "Lightcurve and other quicklook files will not be created until about 15 minutes after the trigger.",
  "alert_datetime": "2024-08-24T02:14:54",
  "data_archive_page": "http://heasarc.gsfc.nasa.gov/FTP/fermi/data/gbm/triggers/2024/bn240812094",
  "detectors_status": [ "triggered", "on", "triggered", "triggered", "on", "on", "triggered", "on", "on", "on", "on", "on", "on", "on" ],
  "event_name": ["GRB240812A"],
  "id": [ "745121685", "bn240812094" ],
  "latitude": 23.83,
  "light_curve_url": "http://heasarc.gsfc.nasa.gov/FTP/fermi/data/gbm/triggers/2024/bn240812094/quicklook/glg_lc_medres34_bn240812094.gif",
  "longitude": 257.4,
  "notice_type": "FERMI_GBM_ALERT",
  "rate_duration": 2.048,
  "rate_energy_range": [ 47, 291 ],
  "rate_snr": 4.9,
  "record_number": 1,
  "trigger_algorithm_number": 14,
  "trigger_time": "2024-08-24T02:14:40.43"
}
